codeValue,assessmentIdentifier,namespace,description
Motor,DIAL4,uri://pearson.com/DIAL4/AcademicSubjectDescriptor,Evaluates fine and gross motor skills.
Language,DIAL4,uri://pearson.com/DIAL4/AcademicSubjectDescriptor,Assesses language comprehension and usage.
Concepts,DIAL4,uri://pearson.com/DIAL4/AcademicSubjectDescriptor,Tests understanding of basic concepts.
SelfHelp,DIAL4,uri://pearson.com/DIAL4/AcademicSubjectDescriptor,Measures self-care and independence.
Social,DIAL4,uri://pearson.com/DIAL4/AcademicSubjectDescriptor,Evaluates interpersonal and social skills.
