codeValue,description,namespace,shortDescription
Result,The grade result the student achieved on the exam,uri://cambridgeinternational.org/AssessmentReportingMethodDescriptor,Result
Endorsement,Endorsements are generally only speaking endorsements in language courses and are optional. Most students will not have an endorsement and this will be blank.,uri://cambridgeinternational.org/AssessmentReportingMethodDescriptor,Endorsement
Endorsement Grade,The grade result the student achieved on the endorsement where applicable,uri://cambridgeinternational.org/AssessmentReportingMethodDescriptor,Endorsement Grade
Qualification,The level at which the exam was taken,uri://cambridgeinternational.org/AssessmentReportingMethodDescriptor,Qualification
Subject Code,Subject Code,uri://cambridgeinternational.org/AssessmentReportingMethodDescriptor,Subject Code
Subject Name,Subject Name,uri://cambridgeinternational.org/AssessmentReportingMethodDescriptor,Subject Name
AICE Diploma Level,The Cambridge AICE Diploma is a group certificate that is awarded on a points system. Distinction: 360-420 points; Merit: 250-359 points; Pass: 140-249 points.,uri://cambridgeinternational.org/AssessmentReportingMethodDescriptor,AICE Diploma Level